# name: test/sql/write/dml_update.test
# description: UPDATE on attached ClickHouse tables, translated into ALTER TABLE … UPDATE
# group: [write]

require clickhouse_scanner

require-env CLICKHOUSE_TEST_HOST

require-env CLICKHOUSE_TEST_PORT

require-env CLICKHOUSE_TEST_USER

require-env CLICKHOUSE_TEST_PASSWORD

statement ok
ATTACH 'host=${CLICKHOUSE_TEST_HOST} port=${CLICKHOUSE_TEST_PORT} user=${CLICKHOUSE_TEST_USER} password=${CLICKHOUSE_TEST_PASSWORD} database=test_db' AS ch (TYPE clickhouse);

statement ok
CALL clickhouse_execute('ch', 'DROP DATABASE IF EXISTS w_dml2');

statement ok
CALL clickhouse_execute('ch', 'CREATE DATABASE w_dml2');

statement ok
CALL clickhouse_execute('ch', 'CREATE TABLE w_dml2.u (id Int32, name String, n Nullable(Int64), ip IPv4, e Enum8(''x'' = 1, ''y'' = 2)) ENGINE = MergeTree ORDER BY id');

statement ok
INSERT INTO ch.w_dml2.u SELECT range::INTEGER, 'name' || range, range, '10.0.0.' || range, 'x' FROM range(5);

# several columns, expressions over the row, affected-row count
query I
UPDATE ch.w_dml2.u SET name = upper(name), n = n * 10 WHERE id >= 3;
----
2

query III
SELECT id, name, n FROM ch.w_dml2.u ORDER BY id;
----
0	name0	0
1	name1	1
2	name2	2
3	NAME3	30
4	NAME4	40

query I
SELECT * FROM clickhouse_query('ch', 'SELECT groupArray(n) FROM (SELECT n FROM w_dml2.u ORDER BY id)');
----
[0, 1, 2, 30, 40]

# NULL, coalesce, no WHERE
query I
UPDATE ch.w_dml2.u SET n = NULL WHERE id = 1;
----
1

query II
SELECT * FROM clickhouse_query('ch', 'SELECT id, n FROM w_dml2.u ORDER BY id');
----
0	0
1	NULL
2	2
3	30
4	40

query I
UPDATE ch.w_dml2.u SET n = coalesce(n, 0) + 1;
----
5

query I
SELECT list(n ORDER BY id) FROM ch.w_dml2.u;
----
[1, 1, 3, 31, 41]

query I
SELECT * FROM clickhouse_query('ch', 'SELECT groupArray(n) FROM (SELECT n FROM w_dml2.u ORDER BY id)');
----
[1, 1, 3, 31, 41]

# enums, server-converted types, CASE
query I
UPDATE ch.w_dml2.u SET e = 'y', ip = '192.168.1.' || id::VARCHAR WHERE e = 'x' AND id < 2;
----
2

query I
UPDATE ch.w_dml2.u SET name = CASE WHEN id % 2 = 0 THEN 'even' ELSE 'odd' END;
----
5

query IIII
SELECT * FROM clickhouse_query('ch', 'SELECT id, name, toString(e), toString(ip) FROM w_dml2.u WHERE id <= 2 ORDER BY id');
----
0	even	y	192.168.1.0
1	odd	y	192.168.1.1
2	even	x	10.0.0.2

# no row can match (DuckDB folds the plan to an empty result): nothing is updated, never every row
query I
UPDATE ch.w_dml2.u SET name = 'z' WHERE 1 = 0;
----
0

query I
SELECT count(*) FROM ch.w_dml2.u WHERE name = 'z';
----
0

query I
SELECT * FROM clickhouse_query('ch', 'SELECT count() FROM w_dml2.u WHERE name = ''z''');
----
0

# prepared statements: every EXECUTE plans the UPDATE again with the parameter values
statement ok
PREPARE pu AS UPDATE ch.w_dml2.u SET n = n + 100 WHERE id = $1;

query I
EXECUTE pu(2);
----
1

query I
EXECUTE pu(3);
----
1

query II
SELECT id, n FROM ch.w_dml2.u ORDER BY id;
----
0	1
1	1
2	103
3	131
4	41

query I
SELECT * FROM clickhouse_query('ch', 'SELECT groupArray(n) FROM (SELECT n FROM w_dml2.u ORDER BY id)');
----
[1, 1, 103, 131, 41]

# a parameter in SET
statement ok
PREPARE pn AS UPDATE ch.w_dml2.u SET name = $2 WHERE id = $1;

query I
EXECUTE pn(4, 'four');
----
1

query II
SELECT id, name FROM ch.w_dml2.u ORDER BY id;
----
0	even
1	odd
2	even
3	odd
4	four

query II
SELECT * FROM clickhouse_query('ch', 'SELECT id, name FROM w_dml2.u ORDER BY id');
----
0	even
1	odd
2	even
3	odd
4	four

# ClickHouse refuses to update a sorting-key column; the error is ClickHouse's
statement error
UPDATE ch.w_dml2.u SET id = 99 WHERE id = 1;
----
ClickHouse error

# rejected before anything runs
statement error
UPDATE ch.w_dml2.u SET name = md5(name);
----
UPDATE on ClickHouse tables must filter only the modified table with translatable expressions

statement error
UPDATE ch.w_dml2.u SET name = 'z' FROM (SELECT 1 AS k) s WHERE u.id = s.k;
----
UPDATE on ClickHouse tables must filter only the modified table with translatable expressions

statement error
UPDATE ch.w_dml2.u SET name = 'z' WHERE id = 1 RETURNING id;
----
RETURNING is not supported for ClickHouse tables

statement error
UPDATE ch.w_dml2.u SET n = DEFAULT;
----
UPDATE on ClickHouse tables must filter only the modified table with translatable expressions

query I
SELECT count(*) FROM ch.w_dml2.u WHERE name = 'z';
----
0

# ch_mutations_sync
statement error
SET ch_mutations_sync = 3;
----
ch_mutations_sync must be 0, 1 or 2

statement ok
SET ch_mutations_sync = 1;

query I
UPDATE ch.w_dml2.u SET name = 'synced' WHERE id = 4;
----
1

statement ok
RESET ch_mutations_sync;

query I
SELECT name FROM ch.w_dml2.u WHERE id = 4;
----
synced

query I
SELECT * FROM clickhouse_query('ch', 'SELECT name FROM w_dml2.u WHERE id = 4');
----
synced

# the setting is sent with the ALTER TABLE … UPDATE: 2 by default, 1 while ch_mutations_sync = 1
statement ok
CALL clickhouse_execute('ch', 'SYSTEM FLUSH LOGS');

query II
SELECT * FROM clickhouse_query('ch', 'SELECT position(query, ''synced'') > 0, Settings[''mutations_sync''] FROM system.query_log WHERE type = ''QueryFinish'' AND query LIKE ''ALTER TABLE `w_dml2`.`u` UPDATE%'' AND (query LIKE ''%synced%'' OR query LIKE ''%192.168.1.%'') ORDER BY event_time_microseconds');
----
0	2
1	1

# an UPDATE of an array column is a DELETE + INSERT for DuckDB, which adds col = col for every other column: those
# are dropped (the sorting key, and columns an expression may not read, included)
statement ok
CALL clickhouse_execute('ch', 'CREATE TABLE w_dml2.a (id Int32, arr Array(Int32), arr2 Array(Int32), fs FixedString(2), d DateTime64(9)) ENGINE = MergeTree ORDER BY id');

statement ok
CALL clickhouse_execute('ch', 'INSERT INTO w_dml2.a VALUES (1, [1], [10, 11], ''ab'', ''2020-01-01 00:00:00.123456789''), (2, [2], [20], ''cd'', ''2021-01-01 00:00:00'')');

query I
UPDATE ch.w_dml2.a SET arr = arr2 WHERE id = 1;
----
1

query II
SELECT id, arr FROM ch.w_dml2.a ORDER BY id;
----
1	[10, 11]
2	[2]

query IIII
SELECT * FROM clickhouse_query('ch', 'SELECT id, toString(arr), fs, toString(d) FROM w_dml2.a ORDER BY id');
----
1	[10,11]	ab	2020-01-01 00:00:00.123456789
2	[2]	cd	2021-01-01 00:00:00.000000000

# FixedString and DateTime64(9) columns can be written (CAST to their own type)...
query I
UPDATE ch.w_dml2.a SET fs = 'zz', d = TIMESTAMP_NS '2022-02-02 02:02:02' WHERE id = 2;
----
1

query II
SELECT * FROM clickhouse_query('ch', 'SELECT fs, toString(d) FROM w_dml2.a WHERE id = 2');
----
zz	2022-02-02 02:02:02.000000000

# ...but not read: DuckDB and ClickHouse do not compare them the same way
statement error
UPDATE ch.w_dml2.a SET arr = [] WHERE d > TIMESTAMPTZ '2000-01-01 00:00:00+00';
----
UPDATE on ClickHouse tables must filter only the modified table with translatable expressions

statement error
UPDATE ch.w_dml2.a SET fs = upper(fs) WHERE id = 1;
----
UPDATE on ClickHouse tables must filter only the modified table with translatable expressions

# a hand-written col = col changes nothing: only the count runs
query I
UPDATE ch.w_dml2.a SET id = id WHERE id = 2;
----
1

query I
SELECT * FROM clickhouse_query('ch', 'SELECT groupArray(id) FROM (SELECT id FROM w_dml2.a ORDER BY id)');
----
[1, 2]

# || (ClickHouse concat): NULL if an operand is NULL, in both
statement ok
CALL clickhouse_execute('ch', 'CREATE TABLE w_dml2.c (id Int32, s Nullable(String), lc LowCardinality(String), d Float64, k UInt32) ENGINE = MergeTree ORDER BY id');

statement ok
INSERT INTO ch.w_dml2.c VALUES (1, 'a', 'l1', 1.0, 10), (2, NULL, 'l2', 2.5, 20), (3, 'c', 'l3', 3.0, 30), (4, NULL, 'l4', 4.0, 40), (5, 'e', 'l5', 5.0, 50), (6, 'f', 'l6', 6.0, 60);

query I
UPDATE ch.w_dml2.c SET s = s || 'x';
----
6

query II
SELECT id, s FROM ch.w_dml2.c ORDER BY id;
----
1	ax
2	NULL
3	cx
4	NULL
5	ex
6	fx

query II
SELECT * FROM clickhouse_query('ch', 'SELECT id, s FROM w_dml2.c ORDER BY id');
----
1	ax
2	NULL
3	cx
4	NULL
5	ex
6	fx

# an integer converts to the same text in both (DuckDB's implicit cast to VARCHAR); a LowCardinality(String) target
query I
UPDATE ch.w_dml2.c SET lc = 'x' || k WHERE id <= 2;
----
2

query II
SELECT id, lc FROM ch.w_dml2.c WHERE id <= 3 ORDER BY id;
----
1	x10
2	x20
3	l3

query III
SELECT * FROM clickhouse_query('ch', 'SELECT id, lc, toTypeName(lc) FROM w_dml2.c WHERE id <= 3 ORDER BY id');
----
1	x10	LowCardinality(String)
2	x20	LowCardinality(String)
3	l3	LowCardinality(String)

# a DOUBLE does not (DuckDB's 1.0 is ClickHouse's 1): rejected, implicit or written
statement error
UPDATE ch.w_dml2.c SET lc = 'x' || d;
----
cast from DOUBLE to VARCHAR, which ClickHouse formats differently

statement error
UPDATE ch.w_dml2.c SET lc = 'z' WHERE d::VARCHAR = '1.0';
----
cast from DOUBLE to VARCHAR, which ClickHouse formats differently

query I
SELECT * FROM clickhouse_query('ch', 'SELECT count() FROM w_dml2.c WHERE lc = ''z'' OR startsWith(lc, ''x'') AND id > 2');
----
0

# an IN list of 5 or more values (rewritten into a MARK join) with a SET reading columns
query I
UPDATE ch.w_dml2.c SET k = k + id WHERE id IN (1, 3, 5, 7, 9);
----
3

query II
SELECT id, k FROM ch.w_dml2.c ORDER BY id;
----
1	11
2	20
3	33
4	40
5	55
6	60

query I
SELECT * FROM clickhouse_query('ch', 'SELECT groupArray(k) FROM (SELECT k FROM w_dml2.c ORDER BY id)');
----
[11, 20, 33, 40, 55, 60]

# WHERE NULL: no row matches, nothing is sent
query I
UPDATE ch.w_dml2.c SET k = 0 WHERE NULL;
----
0

query I
SELECT * FROM clickhouse_query('ch', 'SELECT count() FROM w_dml2.c WHERE k = 0');
----
0

# views are refused
statement ok
CALL clickhouse_execute('ch', 'CREATE VIEW w_dml2.v AS SELECT 1 AS one');

statement error
UPDATE ch.w_dml2.v SET one = 2;
----
is a ClickHouse view

# ---------------------------------------------------------------------------
# SET values cast with DuckDB's rounding: DOUBLE -> INTEGER half to even, DECIMAL scale-down half away from zero
# (ClickHouse's CAST alone truncates both)
# ---------------------------------------------------------------------------
statement ok
CALL clickhouse_execute('ch', 'CREATE TABLE w_dml2.r (id Int32, i Int32, dec Decimal(10, 2), dbl Float64, s String) ENGINE = MergeTree ORDER BY id');

statement ok
INSERT INTO ch.w_dml2.r VALUES (1, 1, 1.25, 0.5, '1.25'), (2, 3, 1.35, 1.5, '1'), (3, 5, -1.25, 2.5, '1'),
    (4, 7, 2.05, 3.5, '1'), (5, -1, 0.45, -0.5, '1'), (6, -3, -2.05, -1.5, '1');

# what DuckDB itself writes, on a DuckDB copy of the table
statement ok
CREATE TABLE r_local AS SELECT * FROM ch.w_dml2.r;

statement ok
UPDATE r_local SET i = i / 2, dec = dec * 1.1;

query I
UPDATE ch.w_dml2.r SET i = i / 2, dec = dec * 1.1;
----
6

query III
SELECT id, i, dec FROM ch.w_dml2.r ORDER BY id;
----
1	0	1.38
2	2	1.49
3	2	-1.38
4	4	2.26
5	0	0.50
6	-2	-2.26

query III
SELECT * FROM clickhouse_query('ch', 'SELECT id, i, dec FROM w_dml2.r ORDER BY id');
----
1	0	1.38
2	2	1.49
3	2	-1.38
4	4	2.26
5	0	0.50
6	-2	-2.26

query I
SELECT count(*) FROM ch.w_dml2.r c JOIN r_local l USING (id) WHERE c.i = l.i AND c.dec = l.dec;
----
6

# an explicit cast, and DECIMAL -> INTEGER (half away from zero)
query I
UPDATE ch.w_dml2.r SET i = CAST(dbl AS INTEGER) * 10 + CAST(dec AS INTEGER);
----
6

query II
SELECT * FROM clickhouse_query('ch', 'SELECT id, i FROM w_dml2.r ORDER BY id');
----
1	1
2	21
3	19
4	42
5	1
6	-22

# rejected: DOUBLE and VARCHAR -> DECIMAL (DuckDB rounds to the scale, ClickHouse truncates)
statement error
UPDATE ch.w_dml2.r SET dec = dbl;
----
cast from DOUBLE to DECIMAL(10,2) has no exact ClickHouse translation

statement error
UPDATE ch.w_dml2.r SET dec = s::DECIMAL(10, 1);
----
cast from VARCHAR to DECIMAL(10,1) has no exact ClickHouse translation

query II
SELECT * FROM clickhouse_query('ch', 'SELECT groupArray(dec), groupArray(i) FROM (SELECT dec, i FROM w_dml2.r ORDER BY id)');
----
[1.38, 1.49, -1.38, 2.26, 0.50, -2.26]	[1, 21, 19, 42, 1, -22]

statement ok
CALL clickhouse_execute('ch', 'DROP DATABASE w_dml2');
